id|code|answers|content|note
566|GZ1||Ценная бумага подвержена Benchmark-тестированию?|Ответ "Да", если ценная бумга подвержена SPPI-тестированию
567|GZ2||Отклонение в потоках по всем сценариям за любой отчетный период и кумулятивно на весь срок действия инструмента равно или превышает 10%?|Ответ на вопрос "Да", в случаях если Benchmark-тест не пройден
568|GZ3||Анализируемым финансовым активом является ценная бумага, приобретенная со значительной премией (свыше 10%)?|Ответ "Да", если ценная бумага приобретается с премией более 10%
569|GZ4||Досрочное погашение возможно по решению Эмитента (call-опцион)?|Ответ "Да", если условия выпуска предусматривают call-опцион
570|GZ5||Согласно мотивированному суждению ответственного подразделения вероятность досрочного погашения финансового актива, приобретенного с премией является незначительной?|Ответ "Да", если согласно мотивированному суждению Пользователя системы, вероятность досрочного погашения анализируемого кредита является незначительной